{
  "id": "openrouter",
  "label": "OpenRouter",
  "description": "Unified API gateway for 300+ models from multiple providers",
  "kind": "openai-chat-completions",
  "api_key_env": "OPENROUTER_API_KEY",
  "base_url": "https://openrouter.ai/api/v1",
  "models": [
    {
      "name": "anthropic/claude-opus-4",
      "task_size": "large",
      "context_window_tokens": 200000,
      "max_output_tokens": 32000,
      "recommended_temperature": 1.0,
      "supports_thinking": true,
      "supports_images": true
    },
    {
      "name": "anthropic/claude-sonnet-4",
      "task_size": "large",
      "context_window_tokens": 1000000,
      "max_output_tokens": 64000,
      "recommended_temperature": 1.0,
      "supports_thinking": true,
      "supports_images": true
    },
    {
      "name": "openai/gpt-5.5",
      "task_size": "large",
      "context_window_tokens": 1050000,
      "max_output_tokens": 128000,
      "recommended_temperature": 1.0,
      "supports_thinking": true,
      "supports_images": true
    },
    {
      "name": "openai/gpt-5.4",
      "task_size": "large",
      "context_window_tokens": 1050000,
      "max_output_tokens": 128000,
      "recommended_temperature": 1.0,
      "supports_thinking": true,
      "supports_images": true
    },
    {
      "name": "openai/gpt-4.1",
      "task_size": "large",
      "context_window_tokens": 1047576,
      "max_output_tokens": 32768,
      "recommended_temperature": 1.0,
      "supports_thinking": true,
      "supports_images": true
    },
    {
      "name": "google/gemini-2.5-pro",
      "task_size": "large",
      "context_window_tokens": 1048576,
      "max_output_tokens": 65536,
      "recommended_temperature": 1.0,
      "supports_thinking": true,
      "supports_images": true
    },
    {
      "name": "google/gemini-2.5-flash",
      "task_size": "small",
      "context_window_tokens": 1048576,
      "max_output_tokens": 65535,
      "recommended_temperature": 1.0,
      "supports_thinking": true,
      "supports_images": true
    },
    {
      "name": "deepseek/deepseek-v4-pro",
      "task_size": "large",
      "context_window_tokens": 1048576,
      "max_output_tokens": 384000,
      "recommended_temperature": 1.0,
      "supports_thinking": true
    },
    {
      "name": "deepseek/deepseek-chat",
      "task_size": "large",
      "context_window_tokens": 131072,
      "max_output_tokens": 16000,
      "recommended_temperature": 1.0,
      "supports_thinking": false
    },
    {
      "name": "x-ai/grok-4",
      "task_size": "large",
      "context_window_tokens": 256000,
      "max_output_tokens": 32768,
      "recommended_temperature": 1.0,
      "supports_thinking": true,
      "supports_images": true
    },
    {
      "name": "x-ai/grok-3",
      "task_size": "large",
      "context_window_tokens": 131072,
      "max_output_tokens": 32768,
      "recommended_temperature": 1.0,
      "supports_thinking": true,
      "supports_images": true
    },
    {
      "name": "meta-llama/llama-3.3-70b",
      "task_size": "large",
      "context_window_tokens": 131072,
      "max_output_tokens": 16384,
      "recommended_temperature": 0.7,
      "supports_thinking": false
    },
    {
      "name": "meta-llama/llama-4-maverick",
      "task_size": "large",
      "context_window_tokens": 1048576,
      "max_output_tokens": 16384,
      "recommended_temperature": 0.7,
      "supports_thinking": false,
      "supports_images": true
    },
    {
      "name": "meta-llama/llama-4-scout",
      "task_size": "small",
      "context_window_tokens": 10000000,
      "max_output_tokens": 16384,
      "recommended_temperature": 0.7,
      "supports_thinking": false,
      "supports_images": true
    },
    {
      "name": "mistralai/mistral-large",
      "task_size": "large",
      "context_window_tokens": 128000,
      "max_output_tokens": 32768,
      "recommended_temperature": 1.0,
      "supports_thinking": false
    },
    {
      "name": "mistralai/codestral",
      "task_size": "large",
      "context_window_tokens": 256000,
      "max_output_tokens": 32768,
      "recommended_temperature": 1.0,
      "supports_thinking": false
    },
    {
      "name": "qwen/qwen3-coder",
      "task_size": "large",
      "context_window_tokens": 1048576,
      "max_output_tokens": 65536,
      "recommended_temperature": 1.0,
      "supports_thinking": true
    },
    {
      "name": "qwen/qwen3-235b-a22b",
      "task_size": "large",
      "context_window_tokens": 131072,
      "max_output_tokens": 8192,
      "recommended_temperature": 0.7,
      "supports_thinking": true
    },
    {
      "name": "qwen/qwen3-32b",
      "task_size": "small",
      "context_window_tokens": 131072,
      "max_output_tokens": 16384,
      "recommended_temperature": 0.7,
      "supports_thinking": true
    },
    {
      "name": "z-ai/glm-4.5",
      "task_size": "large",
      "context_window_tokens": 131072,
      "max_output_tokens": 98304,
      "recommended_temperature": 1.0,
      "supports_thinking": true
    },
    {
      "name": "moonshotai/kimi-k2",
      "task_size": "large",
      "context_window_tokens": 131072,
      "max_output_tokens": 32768,
      "recommended_temperature": 1.0,
      "supports_thinking": false
    }
  ]
}
