{
  "id": "commandcode",
  "label": "Command Code",
  "description": "Command Code CLI API (alpha/generate)",
  "kind": "openai-chat-completions",
  "api_key_env": "CMD_API_KEY",
  "base_url": "https://api.commandcode.ai",
  "tool_calling_mode": "native",
  "models": [
    {
      "name": "claude-sonnet-4-6",
      "context_window_tokens": 1000000,
      "pricing": {
        "input_per_1m": 3.0,
        "output_per_1m": 15.0,
        "currency": "USD"
      }
    },
    {
      "name": "claude-fable-5",
      "context_window_tokens": 1000000,
      "pricing": {
        "input_per_1m": 10.0,
        "output_per_1m": 50.0,
        "currency": "USD"
      }
    },
    {
      "name": "claude-opus-4-8",
      "context_window_tokens": 1000000,
      "pricing": {
        "input_per_1m": 5.0,
        "output_per_1m": 25.0,
        "currency": "USD"
      }
    },
    {
      "name": "claude-opus-4-7",
      "context_window_tokens": 1000000,
      "pricing": {
        "input_per_1m": 30.0,
        "output_per_1m": 150.0,
        "currency": "USD"
      }
    },
    {
      "name": "claude-haiku-4-5-20251001",
      "context_window_tokens": 200000,
      "pricing": {
        "input_per_1m": 1.0,
        "output_per_1m": 5.0,
        "currency": "USD"
      }
    },
    {
      "name": "gpt-5.5",
      "context_window_tokens": 200000,
      "pricing": {
        "input_per_1m": 5.0,
        "output_per_1m": 30.0,
        "currency": "USD"
      }
    },
    {
      "name": "gpt-5.4",
      "context_window_tokens": 400000,
      "pricing": {
        "input_per_1m": 2.5,
        "output_per_1m": 15.0,
        "currency": "USD"
      }
    },
    {
      "name": "gpt-5.3-codex",
      "context_window_tokens": 400000,
      "pricing": {
        "input_per_1m": 2.5,
        "output_per_1m": 15.0,
        "currency": "USD"
      }
    },
    {
      "name": "gpt-5.4-mini",
      "context_window_tokens": 400000,
      "pricing": {
        "input_per_1m": 0.5,
        "output_per_1m": 2.0,
        "currency": "USD"
      }
    },
    {
      "name": "MiniMaxAI/MiniMax-M3",
      "context_window_tokens": 1000000,
      "pricing": {
        "input_per_1m": 0.3,
        "output_per_1m": 1.2,
        "currency": "USD"
      }
    },
    {
      "name": "deepseek/deepseek-v4-pro",
      "context_window_tokens": 1000000,
      "pricing": {
        "input_per_1m": 0.435,
        "output_per_1m": 0.87,
        "currency": "USD"
      }
    },
    {
      "name": "deepseek/deepseek-v4-flash",
      "context_window_tokens": 1000000,
      "pricing": {
        "input_per_1m": 0.09,
        "output_per_1m": 0.18,
        "currency": "USD"
      }
    },
    {
      "name": "moonshotai/Kimi-K2.7-Code",
      "context_window_tokens": 256000,
      "pricing": {
        "input_per_1m": 0.74,
        "output_per_1m": 3.5,
        "currency": "USD"
      }
    },
    {
      "name": "moonshotai/Kimi-K2.6",
      "context_window_tokens": 256000,
      "pricing": {
        "input_per_1m": 0.57,
        "output_per_1m": 2.3,
        "currency": "USD"
      }
    },
    {
      "name": "moonshotai/Kimi-K2.5",
      "context_window_tokens": 256000,
      "pricing": {
        "input_per_1m": 0.57,
        "output_per_1m": 2.3,
        "currency": "USD"
      }
    },
    {
      "name": "zai-org/GLM-5.1",
      "context_window_tokens": 200000,
      "pricing": {
        "input_per_1m": 0.6,
        "output_per_1m": 2.2,
        "currency": "USD"
      }
    },
    {
      "name": "zai-org/GLM-5",
      "context_window_tokens": 200000,
      "pricing": {
        "input_per_1m": 0.6,
        "output_per_1m": 2.2,
        "currency": "USD"
      }
    },
    {
      "name": "MiniMaxAI/MiniMax-M2.7",
      "context_window_tokens": 200000,
      "pricing": {
        "input_per_1m": 0.3,
        "output_per_1m": 1.2,
        "currency": "USD"
      }
    },
    {
      "name": "MiniMaxAI/MiniMax-M2.5",
      "context_window_tokens": 200000,
      "pricing": {
        "input_per_1m": 0.3,
        "output_per_1m": 1.2,
        "currency": "USD"
      }
    },
    {
      "name": "xiaomi/mimo-v2.5-pro",
      "context_window_tokens": 1000000,
      "pricing": {
        "input_per_1m": 0.435,
        "output_per_1m": 0.87,
        "currency": "USD"
      }
    },
    {
      "name": "xiaomi/mimo-v2.5",
      "context_window_tokens": 1000000,
      "pricing": {
        "input_per_1m": 0.105,
        "output_per_1m": 0.28,
        "currency": "USD"
      }
    },
    {
      "name": "Qwen/Qwen3.6-Max-Preview",
      "context_window_tokens": 200000,
      "pricing": {
        "input_per_1m": 1.04,
        "output_per_1m": 6.24,
        "currency": "USD"
      }
    },
    {
      "name": "Qwen/Qwen3.6-Plus",
      "context_window_tokens": 200000,
      "pricing": {
        "input_per_1m": 0.3,
        "output_per_1m": 1.8,
        "currency": "USD"
      }
    },
    {
      "name": "Qwen/Qwen3.7-Max",
      "context_window_tokens": 1000000,
      "pricing": {
        "input_per_1m": 1.25,
        "output_per_1m": 3.75,
        "currency": "USD"
      }
    },
    {
      "name": "Qwen/Qwen3.7-Plus",
      "context_window_tokens": 1000000,
      "pricing": {
        "input_per_1m": 0.32,
        "output_per_1m": 1.28,
        "currency": "USD"
      }
    },
    {
      "name": "stepfun/Step-3.7-Flash",
      "context_window_tokens": 256000,
      "pricing": {
        "input_per_1m": 0.2,
        "output_per_1m": 1.15,
        "currency": "USD"
      }
    },
    {
      "name": "stepfun/Step-3.5-Flash",
      "context_window_tokens": 1000000,
      "pricing": {
        "input_per_1m": 0.2,
        "output_per_1m": 1.15,
        "currency": "USD"
      }
    },
    {
      "name": "google/gemini-3.5-flash",
      "context_window_tokens": 1000000,
      "pricing": {
        "input_per_1m": 1.5,
        "output_per_1m": 9.0,
        "currency": "USD"
      }
    },
    {
      "name": "google/gemini-3.1-flash-lite",
      "context_window_tokens": 1000000,
      "pricing": {
        "input_per_1m": 0.25,
        "output_per_1m": 1.5,
        "currency": "USD"
      }
    },
    {
      "name": "nvidia/nemotron-3-ultra-550b-a55b",
      "context_window_tokens": 1000000,
      "pricing": {
        "input_per_1m": 0.5,
        "output_per_1m": 2.2,
        "currency": "USD"
      }
    }
  ]
}
