{
  "id": "minimax",
  "label": "MiniMax",
  "description": "MiniMax M-series frontier models and legacy abab6.5 series",
  "kind": "openai-chat-completions",
  "api_key_env": "MINIMAX_API_KEY",
  "base_url": "https://api.minimax.io/v1",
  "models": [
    {
      "name": "MiniMax-M3",
      "context_window_tokens": 1000000,
      "max_output_tokens": 128000,
      "recommended_temperature": 1.0,
      "supports_thinking": true,
      "pricing": {
        "input_per_1m": 0.3,
        "output_per_1m": 1.2,
        "currency": "USD"
      }
    },
    {
      "name": "MiniMax-M2.7",
      "context_window_tokens": 204800,
      "max_output_tokens": 128000,
      "recommended_temperature": 1.0,
      "supports_thinking": true,
      "pricing": {
        "input_per_1m": 0.2,
        "output_per_1m": 1.0,
        "currency": "USD"
      }
    },
    {
      "name": "MiniMax-M2.7-highspeed",
      "context_window_tokens": 204800,
      "max_output_tokens": 128000,
      "recommended_temperature": 1.0,
      "supports_thinking": true,
      "pricing": {
        "input_per_1m": 0.4,
        "output_per_1m": 2.0,
        "currency": "USD"
      }
    },
    {
      "name": "MiniMax-M2.5",
      "context_window_tokens": 204800,
      "max_output_tokens": 128000,
      "recommended_temperature": 1.0,
      "supports_thinking": true,
      "pricing": {
        "input_per_1m": 0.2,
        "output_per_1m": 1.0,
        "currency": "USD"
      }
    },
    {
      "name": "MiniMax-M2.5-highspeed",
      "context_window_tokens": 204800,
      "max_output_tokens": 128000,
      "recommended_temperature": 1.0,
      "supports_thinking": true,
      "pricing": {
        "input_per_1m": 0.4,
        "output_per_1m": 2.0,
        "currency": "USD"
      }
    },
    {
      "name": "MiniMax-M2.1",
      "context_window_tokens": 204800,
      "max_output_tokens": 128000,
      "recommended_temperature": 1.0,
      "supports_thinking": true,
      "pricing": {
        "input_per_1m": 0.15,
        "output_per_1m": 0.6,
        "currency": "USD"
      }
    },
    {
      "name": "MiniMax-M2.1-highspeed",
      "context_window_tokens": 204800,
      "max_output_tokens": 128000,
      "recommended_temperature": 1.0,
      "supports_thinking": true,
      "pricing": {
        "input_per_1m": 0.3,
        "output_per_1m": 1.2,
        "currency": "USD"
      }
    },
    {
      "name": "MiniMax-M2",
      "context_window_tokens": 204800,
      "max_output_tokens": 128000,
      "recommended_temperature": 1.0,
      "supports_thinking": true,
      "pricing": {
        "input_per_1m": 0.15,
        "output_per_1m": 0.6,
        "currency": "USD"
      }
    },
    {
      "name": "MiniMax-Text-01",
      "context_window_tokens": 1000000,
      "max_output_tokens": 128000,
      "recommended_temperature": 1.0,
      "supports_thinking": false,
      "pricing": {
        "input_per_1m": 0.2,
        "output_per_1m": 0.8,
        "currency": "USD"
      }
    },
    {
      "name": "MiniMax-Text-01-456B",
      "context_window_tokens": 1000000,
      "max_output_tokens": 128000,
      "recommended_temperature": 1.0,
      "supports_thinking": false,
      "pricing": {
        "input_per_1m": 0.3,
        "output_per_1m": 1.2,
        "currency": "USD"
      }
    },
    {
      "name": "abab6.5-chat",
      "context_window_tokens": 200000,
      "max_output_tokens": 16384,
      "recommended_temperature": 0.7,
      "supports_thinking": false,
      "pricing": {
        "input_per_1m": 0.1,
        "output_per_1m": 0.3,
        "currency": "USD"
      }
    },
    {
      "name": "abab6.5g-chat",
      "context_window_tokens": 200000,
      "max_output_tokens": 8192,
      "recommended_temperature": 0.7,
      "supports_thinking": false,
      "pricing": {
        "input_per_1m": 0.15,
        "output_per_1m": 0.5,
        "currency": "USD"
      }
    },
    {
      "name": "abab6.5s-chat",
      "context_window_tokens": 200000,
      "max_output_tokens": 16384,
      "recommended_temperature": 0.7,
      "supports_thinking": false,
      "pricing": {
        "input_per_1m": 0.05,
        "output_per_1m": 0.15,
        "currency": "USD"
      }
    },
    {
      "name": "abab6.5t-chat",
      "context_window_tokens": 200000,
      "max_output_tokens": 8192,
      "recommended_temperature": 0.7,
      "supports_thinking": false,
      "pricing": {
        "input_per_1m": 0.03,
        "output_per_1m": 0.1,
        "currency": "USD"
      }
    }
  ]
}
