{
  "id": "openrouter",
  "label": "OpenRouter",
  "description": "Unified API for 300+ models",
  "kind": "openai-chat-completions",
  "api_key_env": "OPENROUTER_API_KEY",
  "base_url": "https://openrouter.ai/api/v1",
  "models": [
    {
      "name": "anthropic/claude-opus-4",
      "task_size": "large",
      "context_window_tokens": 200000
    },
    {
      "name": "anthropic/claude-sonnet-4",
      "task_size": "large",
      "context_window_tokens": 200000
    },
    {
      "name": "openai/gpt-5.5",
      "task_size": "large",
      "context_window_tokens": 1000000
    },
    {
      "name": "openai/gpt-5.4",
      "task_size": "large",
      "context_window_tokens": 1000000
    },
    {
      "name": "openai/gpt-4.1",
      "task_size": "large",
      "context_window_tokens": 1000000
    },
    {
      "name": "google/gemini-2.5-pro",
      "task_size": "large",
      "context_window_tokens": 1000000
    },
    {
      "name": "google/gemini-2.5-flash",
      "task_size": "small",
      "context_window_tokens": 1000000
    },
    {
      "name": "deepseek/deepseek-v4-pro",
      "task_size": "large",
      "context_window_tokens": 1000000
    },
    {
      "name": "deepseek/deepseek-chat",
      "task_size": "large",
      "context_window_tokens": 1000000
    },
    {
      "name": "x-ai/grok-4",
      "task_size": "large",
      "context_window_tokens": 256000
    },
    {
      "name": "x-ai/grok-3",
      "task_size": "large",
      "context_window_tokens": 131072
    },
    {
      "name": "meta-llama/llama-3.3-70b",
      "task_size": "large",
      "context_window_tokens": 128000
    },
    {
      "name": "meta-llama/llama-4-maverick",
      "task_size": "large",
      "context_window_tokens": 524288
    },
    {
      "name": "meta-llama/llama-4-scout",
      "task_size": "small",
      "context_window_tokens": 1048576
    },
    {
      "name": "mistralai/mistral-large",
      "task_size": "large",
      "context_window_tokens": 128000
    },
    {
      "name": "mistralai/codestral",
      "task_size": "large",
      "context_window_tokens": 128000
    },
    {
      "name": "qwen/qwen3-coder",
      "task_size": "large",
      "context_window_tokens": 128000
    },
    {
      "name": "qwen/qwen3-235b-a22b",
      "task_size": "large",
      "context_window_tokens": 128000
    },
    {
      "name": "qwen/qwen3-32b",
      "task_size": "small",
      "context_window_tokens": 128000
    },
    {
      "name": "z-ai/glm-4.5",
      "task_size": "large",
      "context_window_tokens": 128000
    },
    {
      "name": "moonshotai/kimi-k2",
      "task_size": "large",
      "context_window_tokens": 128000
    }
  ]
}