{
  "id": "mimo-anthropic-cn",
  "label": "MiMo (China)",
  "description": "Xiaomi MiMo series models via Anthropic-compatible API (China region)",
  "kind": "anthropic-messages",
  "api_key_env": "MIMO_API_KEY",
  "base_url": "https://token-plan-cn.xiaomimimo.com/anthropic",
  "request_options": {
    "anthropic_cache_control": {
      "type": "ephemeral"
    }
  },
  "models": [
    {
      "name": "mimo-v2.5-pro",
      "context_window_tokens": 1100000,
      "max_output_tokens": 131072,
      "recommended_temperature": 1.0,
      "supports_thinking": true,
      "pricing": {
        "input_per_1m": 0.435,
        "output_per_1m": 0.87,
        "currency": "USD"
      }
    },
    {
      "name": "mimo-v2.5",
      "context_window_tokens": 1048576,
      "max_output_tokens": 131072,
      "recommended_temperature": 1.0,
      "supports_thinking": true,
      "pricing": {
        "input_per_1m": 0.105,
        "output_per_1m": 0.28,
        "currency": "USD"
      }
    },
    {
      "name": "mimo-v2-pro",
      "context_window_tokens": 1048576,
      "max_output_tokens": 32768,
      "recommended_temperature": 1.0,
      "supports_thinking": true,
      "pricing": {
        "input_per_1m": 0.2,
        "output_per_1m": 0.5,
        "currency": "USD"
      }
    },
    {
      "name": "mimo-v2-omni",
      "context_window_tokens": 262144,
      "max_output_tokens": 32768,
      "recommended_temperature": 1.0,
      "supports_thinking": false,
      "pricing": {
        "input_per_1m": 0.15,
        "output_per_1m": 0.4,
        "currency": "USD"
      }
    },
    {
      "name": "mimo-v2-flash",
      "context_window_tokens": 262144,
      "max_output_tokens": 8192,
      "recommended_temperature": 1.0,
      "supports_thinking": false,
      "pricing": {
        "input_per_1m": 0.05,
        "output_per_1m": 0.15,
        "currency": "USD"
      }
    }
  ]
}
