{
  "id": "xai",
  "label": "xAI",
  "description": "xAI's Grok model family with large context windows, reasoning, and agentic capabilities",
  "kind": "openai-responses",
  "api_key_env": "XAI_API_KEY",
  "base_url": "https://api.x.ai/v1",
  "models": [
    {
      "name": "grok-4.5",
      "context_window_tokens": 500000,
      "max_output_tokens": 131072,
      "recommended_temperature": 1.0,
      "supports_thinking": true,
      "pricing": {
        "input_per_1m": 2.0,
        "output_per_1m": 6.0,
        "currency": "USD"
      }
    },
    {
      "name": "grok-4.5-latest",
      "context_window_tokens": 500000,
      "max_output_tokens": 131072,
      "recommended_temperature": 1.0,
      "supports_thinking": true,
      "pricing": {
        "input_per_1m": 2.0,
        "output_per_1m": 6.0,
        "currency": "USD"
      }
    },
    {
      "name": "grok-4.3",
      "context_window_tokens": 1000000,
      "max_output_tokens": 131072,
      "recommended_temperature": 1.0,
      "supports_thinking": true,
      "pricing": {
        "input_per_1m": 1.25,
        "output_per_1m": 2.5,
        "currency": "USD"
      }
    },
    {
      "name": "grok-4",
      "context_window_tokens": 1000000,
      "max_output_tokens": 131072,
      "recommended_temperature": 1.0,
      "supports_thinking": true,
      "pricing": {
        "input_per_1m": 1.25,
        "output_per_1m": 2.5,
        "currency": "USD"
      }
    },
    {
      "name": "grok-4-fast",
      "context_window_tokens": 1000000,
      "max_output_tokens": 131072,
      "recommended_temperature": 1.0,
      "supports_thinking": true
    },
    {
      "name": "grok-4-fast-reasoning",
      "context_window_tokens": 1000000,
      "max_output_tokens": 131072,
      "recommended_temperature": 1.0,
      "supports_thinking": true
    },
    {
      "name": "grok-4-fast-non-reasoning",
      "context_window_tokens": 1000000,
      "max_output_tokens": 131072,
      "recommended_temperature": 1.0,
      "supports_thinking": false
    },
    {
      "name": "grok-3",
      "context_window_tokens": 1000000,
      "max_output_tokens": 131072,
      "recommended_temperature": 1.0,
      "supports_thinking": true,
      "pricing": {
        "input_per_1m": 1.25,
        "output_per_1m": 2.5,
        "currency": "USD"
      }
    },
    {
      "name": "grok-3-fast",
      "context_window_tokens": 1000000,
      "max_output_tokens": 131072,
      "recommended_temperature": 1.0,
      "supports_thinking": false
    },
    {
      "name": "grok-3-mini",
      "context_window_tokens": 131072,
      "max_output_tokens": 16384,
      "recommended_temperature": 1.0,
      "supports_thinking": true,
      "pricing": {
        "input_per_1m": 0.3,
        "output_per_1m": 1.0,
        "currency": "USD"
      }
    },
    {
      "name": "grok-3-mini-fast",
      "context_window_tokens": 131072,
      "max_output_tokens": 16384,
      "recommended_temperature": 1.0,
      "supports_thinking": false
    },
    {
      "name": "grok-2-1212",
      "context_window_tokens": 131072,
      "max_output_tokens": 16384,
      "recommended_temperature": 1.0,
      "supports_thinking": false,
      "attachments": {
        "images": false
      }
    },
    {
      "name": "grok-2-vision-1212",
      "context_window_tokens": 131072,
      "max_output_tokens": 16384,
      "recommended_temperature": 1.0,
      "supports_thinking": false
    },
    {
      "name": "composer-2.5",
      "context_window_tokens": 256000,
      "max_output_tokens": 65536,
      "recommended_temperature": 1.0,
      "supports_thinking": true,
      "pricing": {
        "input_per_1m": 1.0,
        "output_per_1m": 2.0,
        "currency": "USD"
      }
    },
    {
      "name": "grok-composer-2.5-fast",
      "context_window_tokens": 256000,
      "max_output_tokens": 65536,
      "recommended_temperature": 1.0,
      "supports_thinking": true,
      "pricing": {
        "input_per_1m": 3.0,
        "output_per_1m": 15.0,
        "currency": "USD"
      }
    },
    {
      "name": "grok-build-0.1",
      "context_window_tokens": 256000,
      "max_output_tokens": 16384,
      "recommended_temperature": 1.0,
      "supports_thinking": false,
      "attachments": {
        "images": false
      }
    }
  ],
  "defaults": {
    "attachments": {
      "images": true,
      "audio": false,
      "video": false,
      "documents": false
    }
  }
}
