{
  "id": "charm-hyper",
  "label": "Charm Hyper",
  "description": "Aggregator provider with curated model access",
  "kind": "openai-chat-completions",
  "api_key_env": "CHARM_HYPER_API_KEY",
  "base_url": "https://hyper.charm.land/v1",
  "models": [
    {
      "name": "Kimi K2.6",
      "context_window_tokens": 256000,
      "max_output_tokens": 16384,
      "recommended_temperature": 1.0,
      "supports_thinking": true,
      "pricing": {
        "input_per_1m": 0.57,
        "output_per_1m": 2.3,
        "currency": "USD"
      }
    },
    {
      "name": "Kimi K2.5",
      "context_window_tokens": 256000,
      "max_output_tokens": 16384,
      "recommended_temperature": 1.0,
      "supports_thinking": true,
      "pricing": {
        "input_per_1m": 0.57,
        "output_per_1m": 2.3,
        "currency": "USD"
      }
    },
    {
      "name": "DeepSeek V4 Pro",
      "context_window_tokens": 1000000,
      "max_output_tokens": 16384,
      "recommended_temperature": 1.0,
      "supports_thinking": true,
      "pricing": {
        "input_per_1m": 0.435,
        "output_per_1m": 0.87,
        "currency": "USD"
      }
    },
    {
      "name": "DeepSeek V4 Flash",
      "context_window_tokens": 1000000,
      "max_output_tokens": 16384,
      "recommended_temperature": 1.0,
      "supports_thinking": true,
      "pricing": {
        "input_per_1m": 0.09,
        "output_per_1m": 0.18,
        "currency": "USD"
      }
    },
    {
      "name": "Gemma 4 26B A4B",
      "context_window_tokens": 262144,
      "max_output_tokens": 8192,
      "recommended_temperature": 1.0,
      "supports_thinking": true,
      "pricing": {
        "input_per_1m": 0.1,
        "output_per_1m": 0.2,
        "currency": "USD"
      }
    },
    {
      "name": "GLM-5.2",
      "context_window_tokens": 1048000,
      "max_output_tokens": 16384,
      "recommended_temperature": 1.0,
      "supports_thinking": true,
      "pricing": {
        "input_per_1m": 1.4,
        "output_per_1m": 4.4,
        "currency": "USD"
      }
    },
    {
      "name": "GLM-5.1",
      "context_window_tokens": 200000,
      "max_output_tokens": 16384,
      "recommended_temperature": 1.0,
      "supports_thinking": true,
      "pricing": {
        "input_per_1m": 1.3,
        "output_per_1m": 4.3,
        "currency": "USD"
      }
    },
    {
      "name": "GLM-5",
      "context_window_tokens": 200000,
      "max_output_tokens": 16384,
      "recommended_temperature": 1.0,
      "supports_thinking": true,
      "pricing": {
        "input_per_1m": 0.91,
        "output_per_1m": 2.836,
        "currency": "USD"
      }
    },
    {
      "name": "Qwen 3 32B",
      "context_window_tokens": 128000,
      "max_output_tokens": 8192,
      "recommended_temperature": 1.0,
      "supports_thinking": true,
      "pricing": {
        "input_per_1m": 0.08,
        "output_per_1m": 0.28,
        "currency": "USD"
      }
    },
    {
      "name": "MiniMax M2.1",
      "context_window_tokens": 204800,
      "max_output_tokens": 8192,
      "recommended_temperature": 1.0,
      "supports_thinking": true,
      "pricing": {
        "input_per_1m": 0.3,
        "output_per_1m": 1.2,
        "currency": "USD"
      }
    },
    {
      "name": "gpt-oss-120b",
      "context_window_tokens": 128000,
      "max_output_tokens": 16384,
      "recommended_temperature": 1.0,
      "supports_thinking": false,
      "pricing": {
        "input_per_1m": 0.03,
        "output_per_1m": 0.15,
        "currency": "USD"
      }
    },
    {
      "name": "gpt-oss-20b",
      "context_window_tokens": 128000,
      "max_output_tokens": 8192,
      "recommended_temperature": 1.0,
      "supports_thinking": false,
      "pricing": {
        "input_per_1m": 0.029,
        "output_per_1m": 0.14,
        "currency": "USD"
      }
    }
  ]
}
