{
  "id": "zai",
  "label": "Z.AI",
  "description": "GLM models by Zhipu AI",
  "kind": "openai-chat-completions",
  "api_key_env": "ZAI_API_KEY",
  "base_url": "https://api.z.ai/api/paas/v4/",
  "models": [
    {
      "name": "glm-5.1",
      "task_size": "large",
      "context_window_tokens": 200000
    },
    {
      "name": "glm-5",
      "task_size": "large",
      "context_window_tokens": 200000
    },
    {
      "name": "glm-5-turbo",
      "task_size": "small",
      "context_window_tokens": 200000
    },
    {
      "name": "glm-4.7",
      "task_size": "large",
      "context_window_tokens": 200000
    },
    {
      "name": "glm-4.6",
      "task_size": "small",
      "context_window_tokens": 200000
    },
    {
      "name": "glm-4.5-air",
      "task_size": "small",
      "context_window_tokens": 128000
    },
    {
      "name": "glm-4.5-x",
      "task_size": "large",
      "context_window_tokens": 128000
    },
    {
      "name": "glm-4.5-flash",
      "task_size": "small",
      "context_window_tokens": 128000
    },
    {
      "name": "glm-4-plus",
      "task_size": "large",
      "context_window_tokens": 128000
    },
    {
      "name": "glm-4-flash",
      "task_size": "small",
      "context_window_tokens": 128000
    },
    {
      "name": "glm-4-long",
      "task_size": "large",
      "context_window_tokens": 1000000
    },
    {
      "name": "glm-4-air",
      "task_size": "small",
      "context_window_tokens": 128000
    },
    {
      "name": "glm-4-airx",
      "task_size": "small",
      "context_window_tokens": 128000
    },
    {
      "name": "glm-4-0520",
      "task_size": "large",
      "context_window_tokens": 128000
    }
  ]
}