{
  "id": "opencode-go",
  "label": "OpenCode Go",
  "description": "Low-cost multi-model coding subscription with open-source models from DeepSeek, Qwen, GLM, Kimi, and MiniMax. $10/mo flat rate with generous usage limits.",
  "kind": "openai-chat-completions",
  "api_key_env": "OPENCODE_GO_API_KEY",
  "base_url": null,
  "models": [
    {
      "name": "deepseek-v4-flash",
      "task_size": "large",
      "context_window_tokens": 1000000,
      "max_output_tokens": 384000,
      "recommended_temperature": 1.0,
      "supports_thinking": false
    },
    {
      "name": "deepseek-v4-pro",
      "task_size": "large",
      "context_window_tokens": 1000000,
      "max_output_tokens": 384000,
      "recommended_temperature": 1.0,
      "supports_thinking": true
    },
    {
      "name": "qwen3.6-plus",
      "task_size": "large",
      "context_window_tokens": 1000000,
      "max_output_tokens": 65536,
      "recommended_temperature": 1.0,
      "supports_thinking": false
    },
    {
      "name": "glm-5",
      "task_size": "large",
      "context_window_tokens": 202752,
      "max_output_tokens": 32768,
      "recommended_temperature": 1.0,
      "supports_thinking": false
    },
    {
      "name": "kimi-k2.5",
      "task_size": "large",
      "context_window_tokens": 262144,
      "max_output_tokens": 65536,
      "recommended_temperature": 1.0,
      "supports_thinking": false
    },
    {
      "name": "minimax-m2.5",
      "task_size": "large",
      "context_window_tokens": 204800,
      "max_output_tokens": 131072,
      "recommended_temperature": 1.0,
      "supports_thinking": false
    }
  ]
}
