{
  "id": "google-gemini",
  "label": "Google Gemini",
  "description": "Gemini API key",
  "kind": "gemini-generate-content",
  "api_key_env": "GEMINI_API_KEY",
  "base_url": "https://generativelanguage.googleapis.com/v1beta/openai/",
  "models": [
    {
      "name": "gemini-2.5-pro",
      "task_size": "large",
      "context_window_tokens": 1000000
    },
    {
      "name": "gemini-2.5-flash",
      "task_size": "small",
      "context_window_tokens": 1000000
    },
    {
      "name": "gemini-2.5-flash-lite",
      "task_size": "small",
      "context_window_tokens": 1000000
    },
    {
      "name": "gemini-2.0-flash",
      "task_size": "small",
      "context_window_tokens": 1000000
    },
    {
      "name": "gemini-2.0-flash-001",
      "task_size": "small",
      "context_window_tokens": 1000000
    },
    {
      "name": "gemini-2.0-flash-lite",
      "task_size": "small",
      "context_window_tokens": 1000000
    },
    {
      "name": "gemini-1.5-pro",
      "task_size": "large",
      "context_window_tokens": 2000000
    },
    {
      "name": "gemini-1.5-pro-002",
      "task_size": "large",
      "context_window_tokens": 2000000
    },
    {
      "name": "gemini-1.5-flash",
      "task_size": "small",
      "context_window_tokens": 1000000
    },
    {
      "name": "gemini-1.5-flash-002",
      "task_size": "small",
      "context_window_tokens": 1000000
    },
    {
      "name": "gemini-1.5-flash-8b",
      "task_size": "small",
      "context_window_tokens": 1000000
    }
  ]
}