{
  "id": "stepfun",
  "label": "StepFun",
  "description": "Chinese AI company developing the Step series of multimodal and reasoning models with OpenAI-compatible API",
  "kind": "openai-chat-completions",
  "api_key_env": "STEP_API_KEY",
  "base_url": "https://api.stepfun.ai/v1",
  "models": [
    {
      "name": "step-3.5-flash",
      "task_size": "large",
      "context_window_tokens": 262144,
      "max_output_tokens": 65536,
      "recommended_temperature": 1.0,
      "supports_thinking": true,
      "pricing": {
        "input_per_1m": 0.2,
        "output_per_1m": 1.15,
        "currency": "USD"
      }
    },
    {
      "name": "step-3",
      "task_size": "large",
      "context_window_tokens": 262144,
      "max_output_tokens": 16384,
      "recommended_temperature": 1.0,
      "supports_thinking": false,
      "pricing": {
        "input_per_1m": 0.5,
        "output_per_1m": 3.0,
        "currency": "USD"
      }
    },
    {
      "name": "step-2-16k",
      "task_size": "large",
      "context_window_tokens": 16384,
      "max_output_tokens": 8192,
      "recommended_temperature": 0.7,
      "supports_thinking": false,
      "pricing": {
        "input_per_1m": 0.3,
        "output_per_1m": 1.5,
        "currency": "USD"
      }
    },
    {
      "name": "step-2",
      "task_size": "large",
      "context_window_tokens": 1000000,
      "max_output_tokens": 8192,
      "recommended_temperature": 0.7,
      "supports_thinking": false,
      "pricing": {
        "input_per_1m": 0.3,
        "output_per_1m": 1.5,
        "currency": "USD"
      }
    },
    {
      "name": "step-1-256k",
      "task_size": "large",
      "context_window_tokens": 262144,
      "max_output_tokens": 8192,
      "recommended_temperature": 0.7,
      "supports_thinking": false,
      "pricing": {
        "input_per_1m": 0.2,
        "output_per_1m": 1.0,
        "currency": "USD"
      }
    },
    {
      "name": "step-1-128k",
      "task_size": "large",
      "context_window_tokens": 131072,
      "max_output_tokens": 8192,
      "recommended_temperature": 0.7,
      "supports_thinking": false,
      "pricing": {
        "input_per_1m": 0.15,
        "output_per_1m": 0.8,
        "currency": "USD"
      }
    },
    {
      "name": "step-1-32k",
      "task_size": "large",
      "context_window_tokens": 32768,
      "max_output_tokens": 32768,
      "recommended_temperature": 0.7,
      "supports_thinking": false,
      "pricing": {
        "input_per_1m": 0.08,
        "output_per_1m": 0.4,
        "currency": "USD"
      }
    },
    {
      "name": "step-1-8k",
      "task_size": "large",
      "context_window_tokens": 8192,
      "max_output_tokens": 8192,
      "recommended_temperature": 0.7,
      "supports_thinking": false,
      "pricing": {
        "input_per_1m": 0.03,
        "output_per_1m": 0.15,
        "currency": "USD"
      }
    },
    {
      "name": "step-1v",
      "task_size": "large",
      "context_window_tokens": 131072,
      "max_output_tokens": 8192,
      "recommended_temperature": 0.7,
      "supports_thinking": false,
      "pricing": {
        "input_per_1m": 0.05,
        "output_per_1m": 0.25,
        "currency": "USD"
      }
    },
    {
      "name": "step-1",
      "task_size": "large",
      "context_window_tokens": 131072,
      "max_output_tokens": 8192,
      "recommended_temperature": 0.7,
      "supports_thinking": false,
      "pricing": {
        "input_per_1m": 0.03,
        "output_per_1m": 0.15,
        "currency": "USD"
      }
    }
  ]
}
