{
  "id": "opencode-go",
  "label": "OpenCode Go",
  "description": "Low-cost multi-model coding subscription with open-source models from DeepSeek, Qwen, GLM, Kimi, and MiniMax. $10/mo flat rate with generous usage limits.",
  "kind": "openai-chat-completions",
  "api_key_env": "OPENCODE_GO_API_KEY",
  "base_url": null,
  "models": [
    {
      "name": "deepseek-v4-flash",
      "task_size": "small",
      "context_window_tokens": 1000000,
      "max_output_tokens": 384000,
      "recommended_temperature": 1.0,
      "supports_thinking": false,
      "pricing": {
        "input_per_1m": 0.09,
        "output_per_1m": 0.18,
        "currency": "USD"
      }
    },
    {
      "name": "deepseek-v4-pro",
      "task_size": "large",
      "context_window_tokens": 1000000,
      "max_output_tokens": 384000,
      "recommended_temperature": 1.0,
      "supports_thinking": true,
      "pricing": {
        "input_per_1m": 0.435,
        "output_per_1m": 0.87,
        "currency": "USD"
      }
    },
    {
      "name": "qwen3.6-plus",
      "task_size": "large",
      "context_window_tokens": 1000000,
      "max_output_tokens": 65536,
      "recommended_temperature": 1.0,
      "supports_thinking": false,
      "pricing": {
        "input_per_1m": 0.3,
        "output_per_1m": 1.8,
        "currency": "USD"
      }
    },
    {
      "name": "glm-5",
      "task_size": "large",
      "context_window_tokens": 202752,
      "max_output_tokens": 32768,
      "recommended_temperature": 1.0,
      "supports_thinking": false,
      "pricing": {
        "input_per_1m": 0.6,
        "output_per_1m": 2.2,
        "currency": "USD"
      }
    },
    {
      "name": "kimi-k2.5",
      "task_size": "large",
      "context_window_tokens": 262144,
      "max_output_tokens": 65536,
      "recommended_temperature": 1.0,
      "supports_thinking": false,
      "pricing": {
        "input_per_1m": 0.57,
        "output_per_1m": 2.3,
        "currency": "USD"
      }
    },
    {
      "name": "minimax-m2.5",
      "task_size": "small",
      "context_window_tokens": 204800,
      "max_output_tokens": 131072,
      "recommended_temperature": 1.0,
      "supports_thinking": false,
      "pricing": {
        "input_per_1m": 0.2,
        "output_per_1m": 1.0,
        "currency": "USD"
      }
    }
  ]
}
