{
  "id": "llamacpp",
  "label": "Llama.cpp",
  "description": "Self-hosted GGUF inference",
  "kind": "openai-chat-completions",
  "api_key_env": "LLAMACPP_API_KEY",
  "base_url": "http://localhost:8080/v1",
  "models": [
    {
      "name": "local-model",
      "context_window_tokens": 128000
    },
    {
      "name": "qwen2.5-coder",
      "context_window_tokens": 128000
    },
    {
      "name": "deepseek-coder",
      "context_window_tokens": 1000000
    },
    {
      "name": "starcoder2",
      "context_window_tokens": 16000
    },
    {
      "name": "granite-code",
      "context_window_tokens": 128000
    },
    {
      "name": "llama3",
      "context_window_tokens": 128000
    },
    {
      "name": "mistral",
      "context_window_tokens": 32000
    },
    {
      "name": "tinyllama",
      "context_window_tokens": 2048
    }
  ]
}
